{
  "version": "2026.05.25",
  "count": 174,
  "items": [
    {
      "id": "cmp_38fc539cb3",
      "name": "中国铁建西派国印",
      "district_group": "市内六区",
      "district": "河北区",
      "available_units": {
        "bucket": "10-50",
        "raw": "10-50套"
      },
      "area_segments": "高层,105,125,洋房133停售",
      "price_segments": "一期现房105精装400万左右\n125精装500万左右\n二期\n洋房133平米，停售",
      "finish_type": "毛坯/精装",
      "delivery_time": "现房",
      "source": "YH-XLSX",
      "source_row": 1,
      "is_new_house": true,
      "sensitive": {
        "pros": "现房，即买即住即落户，河北区昆一学校，书包房",
        "cons": "价格高，可选性低，噪音问题。地铁远",
        "source": "YH-XLSX",
        "note": "永辉房产主观点评, 仅作参考"
      }
    },
    {
      "id": "cmp_6d11b80e7e",
      "name": "启航精英公寓",
      "district_group": "市内六区",
      "district": "南开区",
      "available_units": {
        "bucket": ">50",
        "raw": "＞50套"
      },
      "area_segments": "高层50-70平\n高层70-82平\n高层85平",
      "price_segments": "高层50-70平：203万-250万\n高层70-82平：246—290万\n高层85平：280-290万",
      "finish_type": "精装",
      "delivery_time": "精装现房",
      "source": "YH-XLSX",
      "source_row": 17,
      "is_new_house": true,
      "sensitive": {
        "pros": "现房可选，便宜",
        "cons": "公寓，年限问题，流通性问题",
        "source": "YH-XLSX",
        "note": "永辉房产主观点评, 仅作参考"
      }
    },
    {
      "id": "cmp_983ef3004e",
      "name": "金汇云璟",
      "district_group": "环城四区",
      "district": "北辰区",
      "available_units": {
        "bucket": ">50",
        "raw": "＞50套"
      },
      "area_segments": "小高：87、99平；洋房97、128平",
      "price_segments": "小高125-165万，洋房157-250万",
      "finish_type": "精装",
      "delivery_time": "2025-12-31",
      "source": "YH-XLSX",
      "source_row": 24,
      "is_new_house": true,
      "sensitive": {
        "pros": "价格合适，准现房，产品可选",
        "cons": "开发商之前为金侨，出现过资金问题，项目品质不一定保障",
        "source": "YH-XLSX",
        "note": "永辉房产主观点评, 仅作参考"
      }
    },
    {
      "id": "cmp_aafad0408b",
      "name": "天骥智谷",
      "district_group": "环城四区",
      "district": "东丽区",
      "available_units": {
        "bucket": ">50",
        "raw": "＞50套"
      },
      "area_segments": "高层：83/92/113㎡",
      "price_segments": "83㎡：58-60万\n92㎡：65-70万\n113㎡：71-80万",
      "finish_type": "毛坯",
      "delivery_time": "现房",
      "source": "YH-XLSX",
      "source_row": 28,
      "is_new_house": true,
      "sensitive": {
        "pros": "东丽湖环境不错，价格便宜，可选",
        "cons": "四大湖众所周知，卖了N年还有房，配套一般",
        "source": "YH-XLSX",
        "note": "永辉房产主观点评, 仅作参考"
      }
    },
    {
      "id": "cmp_f58308291c",
      "name": "保盈家园",
      "district_group": "市内六区",
      "district": "南开区",
      "available_units": {
        "bucket": "10-50",
        "raw": "10-50套"
      },
      "area_segments": "洋房91㎡、123㎡",
      "price_segments": "91平米的300万起\n123平米的453万起",
      "finish_type": "毛坯",
      "delivery_time": "现房",
      "source": "YH-XLSX",
      "source_row": 118,
      "is_new_house": true,
      "sensitive": {
        "pros": "价格便宜，现房",
        "cons": "还迁房品质，户型一般",
        "source": "YH-XLSX",
        "note": "永辉房产主观点评, 仅作参考"
      }
    },
    {
      "id": "cmp_18a93ddae9",
      "name": "四季春晓",
      "district_group": "环城四区",
      "district": "津南区",
      "available_units": {
        "bucket": ">50",
        "raw": "＞50套"
      },
      "area_segments": "洋房：78-115㎡",
      "price_segments": "洋房78平126-140万 101平:170-180万 115平:185-195万",
      "finish_type": "毛坯",
      "delivery_time": "2025.6.30",
      "source": "YH-XLSX",
      "source_row": 36,
      "is_new_house": true,
      "sensitive": {
        "pros": "便宜，海教园",
        "cons": "隔壁颐景园啊，海教园最南侧，阳光城 金科难兄难弟了",
        "source": "YH-XLSX",
        "note": "永辉房产主观点评, 仅作参考"
      }
    },
    {
      "id": "cmp_684efb9f06",
      "name": "中国铁建公馆189",
      "district_group": "市内六区",
      "district": "河北区",
      "available_units": {
        "bucket": "10-50",
        "raw": "10-50套"
      },
      "area_segments": "平层53平米/56平米/82平米101平米  loft53平米/56平米/",
      "price_segments": "平层55平63万起\n平层82平79万起\n平层100平99万起\nloft53平67万起\nloft56平74万起",
      "finish_type": "精装",
      "delivery_time": "现房",
      "source": "YH-XLSX",
      "source_row": 2,
      "is_new_house": true,
      "sensitive": {
        "pros": "户型多，现房。",
        "cons": "公寓，年限问题，流通性问题",
        "source": "YH-XLSX",
        "note": "永辉房产主观点评, 仅作参考"
      }
    },
    {
      "id": "cmp_19b3dd9ca7",
      "name": "北宁公元",
      "district_group": "市内六区",
      "district": "河北区",
      "available_units": {
        "bucket": ">50",
        "raw": "＞50套"
      },
      "area_segments": "高层/88/97/106/119/130㎡",
      "price_segments": "88两室中户（210～220万）【剩2层，14层18层，顶层】\n106边户（260万）【剩1/2/顶】\n 97平米 中户（250～264）万(剩余4/14/18/20层）\n119平米  银角（310万）万（剩余6/13/14/18/20/顶）\n130平米  金角（350万）万 可选",
      "finish_type": "毛坯",
      "delivery_time": "现房",
      "source": "YH-XLSX",
      "source_row": 3,
      "is_new_house": true,
      "sensitive": {
        "pros": "价格便宜，地铁近，现房",
        "cons": "可选性低，产品差，之前天房项目",
        "source": "YH-XLSX",
        "note": "永辉房产主观点评, 仅作参考"
      }
    },
    {
      "id": "cmp_4b6e6c7c11",
      "name": "中海·城市广场·钻石湾",
      "district_group": "市内六区",
      "district": "河东区",
      "available_units": {
        "bucket": ">50",
        "raw": "＞50套"
      },
      "area_segments": "跃层：310平米，公寓60平米",
      "price_segments": "跃层310平米：1400万 公寓60平米：100-180万",
      "finish_type": "精装/毛坯",
      "delivery_time": "现房/2023年6月底",
      "source": "YH-XLSX",
      "source_row": 4,
      "is_new_house": true,
      "sensitive": {
        "pros": "现房可选，海河景观资源，大户型",
        "cons": "公寓，年限问题，流通性问题",
        "source": "YH-XLSX",
        "note": "永辉房产主观点评, 仅作参考"
      }
    },
    {
      "id": "cmp_693037ebcb",
      "name": "嘉里·雅颂台",
      "district_group": "市内六区",
      "district": "河东区",
      "available_units": {
        "bucket": ">50",
        "raw": "＞50套"
      },
      "area_segments": "高层：120/170/180/208平米",
      "price_segments": "高层120平米：430-450万 高层170平米630-640万 高层180平米：730-740万 高层208平米880-1100万",
      "finish_type": "精装",
      "delivery_time": "2025年交付",
      "source": "YH-XLSX",
      "source_row": 5,
      "is_new_house": true,
      "sensitive": {
        "pros": "海河一线景观，周边配套成熟，产品不错，改善",
        "cons": "适用于南方风格，改善为主，价格高",
        "source": "YH-XLSX",
        "note": "永辉房产主观点评, 仅作参考"
      }
    },
    {
      "id": "cmp_d2a45107bb",
      "name": "城投万欣城",
      "district_group": "市内六区",
      "district": "河东区",
      "available_units": {
        "bucket": ">50",
        "raw": "＞50套"
      },
      "area_segments": "高层85/110/120/89/117㎡洋房132/143㎡",
      "price_segments": "荷园高层110：290万（仅余顶楼）\n荷园高层120：330-350万（团装）\n梅园高层89：250-270万（团装）\n梅园高层117：350-370万（团装）\n梅园洋房132：460-500万\n梅园洋房143：520-550万",
      "finish_type": "毛坯",
      "delivery_time": "荷园2024年12月，梅园25年8月交房",
      "source": "YH-XLSX",
      "source_row": 6,
      "is_new_house": true,
      "sensitive": {
        "pros": "可选性多，位置好，价格适中",
        "cons": "梅兰竹菊风荷，小区很多，大部分都是四栋楼，绿化问题，具体细分到自己小区。",
        "source": "YH-XLSX",
        "note": "永辉房产主观点评, 仅作参考"
      }
    },
    {
      "id": "cmp_4d9ed2dd80",
      "name": "雍祥园",
      "district_group": "市内六区",
      "district": "河东区",
      "available_units": {
        "bucket": ">50",
        "raw": "＞50套"
      },
      "area_segments": "高层：84/94/110/115/119/122/126/146㎡",
      "price_segments": "高层：84平米：225万左右\n94平米：235万左右\n110平米：280万左右\n115平米：270-290万\n119平米：245-255万\n122平米：265-280\n126平米：255-265万\n147平米：300-320万",
      "finish_type": "毛坯",
      "delivery_time": "现房",
      "source": "YH-XLSX",
      "source_row": 7,
      "is_new_house": true,
      "sensitive": {
        "pros": "现房，可选，交付品质不错",
        "cons": "产品过时，户型设计差，大高层，周边配套一般",
        "source": "YH-XLSX",
        "note": "永辉房产主观点评, 仅作参考"
      }
    },
    {
      "id": "cmp_fd17ee9648",
      "name": "农垦含章雅著",
      "district_group": "市内六区",
      "district": "河东区",
      "available_units": {
        "bucket": ">50",
        "raw": "＞50套"
      },
      "area_segments": "高层：85/95/105/119/131平米 洋房：139/145平米",
      "price_segments": "高层85平米:258万 高层95平米：290-340万 高层105平米：330-360万 高层119平米：385-440万 高层131平米：445-470万 洋房139平米：560万 洋房145平米：720-750万",
      "finish_type": "毛坯",
      "delivery_time": "2023-09-30",
      "source": "YH-XLSX",
      "source_row": 8,
      "is_new_house": true,
      "sensitive": {
        "pros": "现房可选，户型多，园林不错",
        "cons": "户型一般，中环线旁，快速路旁，有一定噪音，学校一般",
        "source": "YH-XLSX",
        "note": "永辉房产主观点评, 仅作参考"
      }
    },
    {
      "id": "cmp_97f5424a3f",
      "name": "格调榴园",
      "district_group": "市内六区",
      "district": "河东区",
      "available_units": {
        "bucket": ">50",
        "raw": "＞50套"
      },
      "area_segments": "高层：90/99/115/120/128/170㎡：洋房：121/131/140",
      "price_segments": "高层90平米：230-260万\n高层99平米：250-280万\n高层115平米：305-330万\n高层120平米：316-325万\n高层128平米：332-370万\n高层170平米：461-482万\n洋房121平米：370-430万\n洋房131平米：430-460万\n洋房140平米：463-496万",
      "finish_type": "毛坯/精装",
      "delivery_time": "现房",
      "source": "YH-XLSX",
      "source_row": 9,
      "is_new_house": true,
      "sensitive": {
        "pros": "可选性多，园林好，地铁近",
        "cons": "价格高，河东区边缘位置，格调卖到现房",
        "source": "YH-XLSX",
        "note": "永辉房产主观点评, 仅作参考"
      }
    },
    {
      "id": "cmp_8c688ec341",
      "name": "创意之城蘭园",
      "district_group": "市内六区",
      "district": "河西区",
      "available_units": {
        "bucket": ">50",
        "raw": "＞50套"
      },
      "area_segments": "小号高80m²89m²  洋房113m²",
      "price_segments": "小高265-320万，洋房450-600万",
      "finish_type": "毛坯",
      "delivery_time": "2025-10-31",
      "source": "YH-XLSX",
      "source_row": 10,
      "is_new_house": true,
      "sensitive": {
        "pros": "产品好，园林绿化不错，价格合适",
        "cons": "柳林刚起步，周期会长，需要等",
        "source": "YH-XLSX",
        "note": "永辉房产主观点评, 仅作参考"
      }
    },
    {
      "id": "cmp_9bfa3aba50",
      "name": "中交融正",
      "district_group": "市内六区",